{"artifact": {"artifact_id": "", "classification": "audit_confidential", "media_type": "application/json", "metadata": {"chains": [{"account": "1101", "date": "2026-01-02", "entry": "E0001", "source_doc": "SD-E0001", "voucher": "V-E0001"}, {"account": "1201", "date": "2026-01-03", "entry": "E0002", "source_doc": "SD-E0002", "voucher": "V-E0002"}, {"account": "1401", "date": "2026-01-04", "entry": "E0003", "source_doc": "SD-E0003", "voucher": "V-E0003"}, {"account": "2001", "date": "2026-01-05", "entry": "E0004", "source_doc": "SD-E0004", "voucher": "V-E0004"}, {"account": "2201", "date": "2026-01-06", "entry": "E0005", "source_doc": "SD-E0005", "voucher": "V-E0005"}, {"account": "2301", "date": "2026-01-07", "entry": "E0006", "source_doc": "SD-E0006", "voucher": "V-E0006"}, {"account": "3101", "date": "2026-01-08", "entry": "E0007", "source_doc": "SD-E0007", "voucher": "V-E0007"}, {"account": "1001", "date": "2026-01-09", "entry": "E0008", "source_doc": "SD-E0008", "voucher": "V-E0008"}, {"account": "1101", "date": "2026-01-10", "entry": "E0009", "source_doc": "SD-E0009", "voucher": "V-E0009"}, {"account": "1201", "date": "2026-01-11", "entry": "E0010", "source_doc": "SD-E0010", "voucher": "V-E0010"}, {"account": "1401", "date": "2026-01-12", "entry": "E0011", "source_doc": "SD-E0011", "voucher": "V-E0011"}, {"account": "2001", "date": "2026-01-13", "entry": "E0012", "source_doc": "SD-E0012", "voucher": "V-E0012"}, {"account": "2201", "date": "2026-01-14", "entry": "E0013", "source_doc": "SD-E0013", "voucher": "V-E0013"}, {"account": "2301", "date": "2026-01-15", "entry": "E0014", "source_doc": "SD-E0014", "voucher": "V-E0014"}, {"account": "3101", "date": "2026-01-16", "entry": "E0015", "source_doc": "SD-E0015", "voucher": "V-E0015"}, {"account": "1001", "date": "2026-01-17", "entry": "E0016", "source_doc": "SD-E0016", "voucher": "V-E0016"}, {"account": "1101", "date": "2026-01-18", "entry": "E0017", "source_doc": "SD-E0017", "voucher": "V-E0017"}, {"account": "1201", "date": "2026-01-19", "entry": "E0018", "source_doc": "SD-E0018", "voucher": "V-E0018"}, {"account": "1401", "date": "2026-01-20", "entry": "E0019", "source_doc": "SD-E0019", "voucher": "V-E0019"}, {"account": "2001", "date": "2026-01-21", "entry": "E0020", "source_doc": "SD-E0020", "voucher": "V-E0020"}, {"account": "2201", "date": "2026-01-22", "entry": "E0021", "source_doc": "SD-E0021", "voucher": "V-E0021"}, {"account": "2301", "date": "2026-01-23", "entry": "E0022", "source_doc": "SD-E0022", "voucher": "V-E0022"}, {"account": "3101", "date": "2026-01-24", "entry": "E0023", "source_doc": "SD-E0023", "voucher": "V-E0023"}, {"account": "1001", "date": "2026-01-25", "entry": "E0024", "source_doc": "SD-E0024", "voucher": "V-E0024"}, {"account": "1101", "date": "2026-01-26", "entry": "E0025", "source_doc": "SD-E0025", "voucher": "V-E0025"}, {"account": "1201", "date": "2026-01-27", "entry": "E0026", "source_doc": "SD-E0026", "voucher": "V-E0026"}, {"account": "1401", "date": "2026-01-28", "entry": "E0027", "source_doc": "SD-E0027", "voucher": "V-E0027"}, {"account": "2001", "date": "2026-01-01", "entry": "E0028", "source_doc": "SD-E0028", "voucher": "V-E0028"}, {"account": "2201", "date": "2026-01-02", "entry": "E0029", "source_doc": "SD-E0029", "voucher": "V-E0029"}, {"account": "2301", "date": "2026-01-03", "entry": "E0030", "source_doc": "SD-E0030", "voucher": "V-E0030"}, {"account": "3101", "date": "2026-01-04", "entry": "E0031", "source_doc": "SD-E0031", "voucher": "V-E0031"}, {"account": "1001", "date": "2026-01-05", "entry": "E0032", "source_doc": "SD-E0032", "voucher": "V-E0032"}, {"account": "1101", "date": "2026-01-06", "entry": "E0033", "source_doc": "SD-E0033", "voucher": "V-E0033"}, {"account": "1201", "date": "2026-01-07", "entry": "E0034", "source_doc": "SD-E0034", "voucher": "V-E0034"}, {"account": "1401", "date": "2026-01-08", "entry": "E0035", "source_doc": "SD-E0035", "voucher": "V-E0035"}, {"account": "2001", "date": "2026-01-09", "entry": "E0036", "source_doc": "SD-E0036", "voucher": "V-E0036"}, {"account": "2201", "date": "2026-01-10", "entry": "E0037", "source_doc": "SD-E0037", "voucher": "V-E0037"}, {"account": "2301", "date": "2026-01-11", "entry": "E0038", "source_doc": "SD-E0038", "voucher": "V-E0038"}, {"account": "3101", "date": "2026-01-12", "entry": "E0039", "source_doc": "SD-E0039", "voucher": "V-E0039"}, {"account": "1001", "date": "2026-01-13", "entry": "E0040", "source_doc": "SD-E0040", "voucher": "V-E0040"}, {"account": "1101", "date": "2026-01-14", "entry": "E0041", "source_doc": "SD-E0041", "voucher": "V-E0041"}, {"account": "1201", "date": "2026-01-15", "entry": "E0042", "source_doc": "SD-E0042", "voucher": "V-E0042"}, {"account": "1401", "date": "2026-01-16", "entry": "E0043", "source_doc": "SD-E0043", "voucher": "V-E0043"}, {"account": "2001", "date": "2026-01-17", "entry": "E0044", "source_doc": "SD-E0044", "voucher": "V-E0044"}, {"account": "2201", "date": "2026-01-18", "entry": "E0045", "source_doc": "SD-E0045", "voucher": "V-E0045"}, {"account": "2301", "date": "2026-01-19", "entry": "E0046", "source_doc": "SD-E0046", "voucher": "V-E0046"}, {"account": "3101", "date": "2026-01-20", "entry": "E0047", "source_doc": "SD-E0047", "voucher": "V-E0047"}, {"account": "1001", "date": "2026-01-21", "entry": "E0048", "source_doc": "SD-E0048", "voucher": "V-E0048"}, {"account": "1101", "date": "2026-01-22", "entry": "E0049", "source_doc": "SD-E0049", "voucher": "V-E0049"}, {"account": "1201", "date": "2026-01-23", "entry": "E0050", "source_doc": "SD-E0050", "voucher": "V-E0050"}, {"account": "1401", "date": "2026-01-24", "entry": "E0051", "source_doc": "SD-E0051", "voucher": "V-E0051"}, {"account": "2001", "date": "2026-01-25", "entry": "E0052", "source_doc": "SD-E0052", "voucher": "V-E0052"}, {"account": "2201", "date": "2026-01-26", "entry": "E0053", "source_doc": "SD-E0053", "voucher": "V-E0053"}, {"account": "2301", "date": "2026-01-27", "entry": "E0054", "source_doc": "SD-E0054", "voucher": "V-E0054"}, {"account": "3101", "date": "2026-01-28", "entry": "E0055", "source_doc": "SD-E0055", "voucher": "V-E0055"}, {"account": "1001", "date": "2026-01-01", "entry": "E0056", "source_doc": "SD-E0056", "voucher": "V-E0056"}, {"account": "1101", "date": "2026-01-02", "entry": "E0057", "source_doc": "SD-E0057", "voucher": "V-E0057"}, {"account": "1201", "date": "2026-01-03", "entry": "E0058", "source_doc": "SD-E0058", "voucher": "V-E0058"}, {"account": "1401", "date": "2026-01-04", "entry": "E0059", "source_doc": "SD-E0059", "voucher": "V-E0059"}, {"account": "2001", "date": "2026-01-05", "entry": "E0060", "source_doc": "SD-E0060", "voucher": "V-E0060"}, {"account": "2201", "date": "2026-01-06", "entry": "E0061", "source_doc": "SD-E0061", "voucher": "V-E0061"}, {"account": "2301", "date": "2026-01-07", "entry": "E0062", "source_doc": "SD-E0062", "voucher": "V-E0062"}, {"account": "3101", "date": "2026-01-08", "entry": "E0063", "source_doc": "SD-E0063", "voucher": "V-E0063"}, {"account": "1001", "date": "2026-01-09", "entry": "E0064", "source_doc": "SD-E0064", "voucher": "V-E0064"}, {"account": "1101", "date": "2026-01-10", "entry": "E0065", "source_doc": "SD-E0065", "voucher": "V-E0065"}, {"account": "1201", "date": "2026-01-11", "entry": "E0066", "source_doc": "SD-E0066", "voucher": "V-E0066"}, {"account": "1401", "date": "2026-01-12", "entry": "E0067", "source_doc": "SD-E0067", "voucher": "V-E0067"}, {"account": "2001", "date": "2026-01-13", "entry": "E0068", "source_doc": "SD-E0068", "voucher": "V-E0068"}, {"account": "2201", "date": "2026-01-14", "entry": "E0069", "source_doc": "SD-E0069", "voucher": "V-E0069"}, {"account": "2301", "date": "2026-01-15", "entry": "E0070", "source_doc": "SD-E0070", "voucher": "V-E0070"}, {"account": "3101", "date": "2026-01-16", "entry": "E0071", "source_doc": "SD-E0071", "voucher": "V-E0071"}, {"account": "1001", "date": "2026-01-17", "entry": "E0072", "source_doc": "SD-E0072", "voucher": "V-E0072"}, {"account": "1101", "date": "2026-01-18", "entry": "E0073", "source_doc": "SD-E0073", "voucher": "V-E0073"}, {"account": "1201", "date": "2026-01-19", "entry": "E0074", "source_doc": "SD-E0074", "voucher": "V-E0074"}, {"account": "1401", "date": "2026-01-20", "entry": "E0075", "source_doc": "SD-E0075", "voucher": "V-E0075"}, {"account": "2001", "date": "2026-01-21", "entry": "E0076", "source_doc": "SD-E0076", "voucher": "V-E0076"}, {"account": "2201", "date": "2026-01-22", "entry": "E0077", "source_doc": "SD-E0077", "voucher": "V-E0077"}, {"account": "2301", "date": "2026-01-23", "entry": "E0078", "source_doc": "SD-E0078", "voucher": "V-E0078"}, {"account": "3101", "date": "2026-01-24", "entry": "E0079", "source_doc": "SD-E0079", "voucher": "V-E0079"}, {"account": "1001", "date": "2026-01-25", "entry": "E0080", "source_doc": "SD-E0080", "voucher": "V-E0080"}, {"account": "1001", "date": "2026-01-10", "entry": "E9001", "source_doc": "SD-E9001", "voucher": "V-E9001"}, {"account": "1001", "date": "2026-01-10", "entry": "E9002", "source_doc": "SD-E9002", "voucher": "V-E9002"}, {"account": "1001", "date": "2026-01-10", "entry": "E9003", "source_doc": "SD-E9003", "voucher": "V-E9003"}, {"account": "2201", "date": "2025-12-31", "entry": "E9201", "source_doc": "SD-E9201", "voucher": "V-E9201"}, {"account": "2201", "date": "2025-12-31", "entry": "E9202", "source_doc": "SD-E9202", "voucher": "V-E9202"}, {"account": "2301", "date": "2026-02-01", "entry": "E9203", "source_doc": "SD-E9203", "voucher": "V-E9203"}, {"account": "2301", "date": "2026-13-01", "entry": "E9204", "source_doc": "SD-E9204", "voucher": "V-E9204"}, {"account": "1101", "date": "2026-01-15", "entry": "E9101", "source_doc": "SD-E9101", "voucher": "V-E9101"}, {"account": "1101", "date": "2026-01-16", "entry": "E9102", "source_doc": "SD-E9102", "voucher": "V-E9102"}, {"account": "2001", "date": "2026-01-20", "entry": "E9301", "source_doc": "SD-E9301", "voucher": "V-E9301"}, {"account": "2001", "date": "2026-01-21", "entry": "E9302",